id,path,question,a,b,c,d,answer
train_2825,train/train_2825.jpg,이 사진에 보이는 음료는 무엇인가요?,커피,맥주,소주,물,b
train_2826,train/train_2826.jpg,이 사진에서 테이블 위에 보이지 않는 것은 무엇인가요?,종이 티슈,음료수 병,젓가락,병따개,b
train_2827,train/train_2827.jpg,이 사진에서 테이블 위에 보이지 않는 것은 무엇일까요?,휴대전화,병뚜껑,물병,병따개,a
train_2828,train/train_2828.jpg,이 사진 속 테이블 위에 보이지 않는 것은 무엇일까요?,병뚜껑,종이티슈,음료수 병,병따개,c
train_2829,train/train_2829.jpg,이 사진에서 보이는 병따개는 무엇을 여는 데 사용하는 도구인가요?,플라스틱 병 뚜껑,병뚜껑,캔,와인 병 마개,b
train_2830,train/train_2830.jpg,사진 속 테이블 위에 보이는 병따개는 어떤 색인가요?,빨간색,노란색,파란색,흰색,d
train_2831,train/train_2831.jpg,이 사진에서 병뚜껑을 따기 위해 사용된 도구는 무엇인가요?,숟가락,가위,포크,병따개,d
train_2832,train/train_2832.jpg,이 사진에서 테이블 위에 보이는 병따개는 무엇을 여는 데 사용되나요?,캔 뚜껑,병뚜껑,음료수 캔,플라스틱 뚜껑,b
train_2833,train/train_2833.jpg,이 사진 속 테이블 위에 없는 것은 무엇일까요?,종이컵,물병,병따개,휴지,a
train_2834,train/train_2834.jpg,사진 속 테이블 위에 있는 병따개 손잡이에 적힌 글자는 무엇인가요?,롯데칠성,오비맥주,카스,하이트진로,d
train_2835,train/train_2835.jpg,이 사진에서 하얀색 손잡이가 달린 도구는 무엇인가요?,병따개,가위,칼,포크,a
train_2836,train/train_2836.jpg,사진 속 테이블 위에 있는 하얀색 손잡이 도구는 무엇인가요?,젓가락,가위,포크,병따개,d
train_2837,train/train_2837.jpg,이 사진 속 병따개에 적힌 글자는 무엇인가요?,CJ제일제당,롯데칠성,하이트진로,오뚜기,c
train_2838,train/train_2838.jpg,사진 속 테이블 위에 있는 흰색 손잡이에 파란 글씨가 적힌 도구는 무엇인가요?,연필,젓가락,병따개,가위,c
train_2839,train/train_2839.jpg,사진 속 테이블 위에 있는 흰색 손잡이의 도구는 무엇인가요?,병따개,가위,펜,열쇠,a
train_2840,train/train_2840.jpg,이 사진에서 테이블 위에 보이는 물건이 아닌 것은 무엇인가요?,우산,병따개,물통,종이컵,d
train_2841,train/train_2841.jpg,이 사진에서 볼 수 없는 것은 무엇인가요?,선풍기,병따개,물병,에어컨,d
train_2842,train/train_2842.jpg,사진 속 공간의 주요 용도는 무엇일까요?,도서관,카페,병원,사무실,b
train_2843,train/train_2843.jpg,사진 속에 보이는 물건 중 우산은 어디에 걸려 있나요?,바닥에 놓여 있다,벽에 걸려 있다,탁자 위에 있다,의자에 놓여 있다,b
train_2844,train/train_2844.jpg,이 사진에서 볼 수 없는 것은 무엇인가요?,가방,선풍기,우산,책,d
train_2845,train/train_2845.jpg,이 사진에 보이는 꽃밭의 주된 꽃은 무엇인가요?,튤립,장미,해바라기,유채꽃,d
train_2846,train/train_2846.jpg,이 사진에 보이는 노란 꽃밭은 무엇인가요?,코스모스밭,벚꽃밭,해바라기밭,유채꽃밭,d
train_2847,train/train_2847.jpg,이 교차로에서 현재 신호등이 보여주는 색깔은 무엇인가요?,빨간색,파란색,노란색,초록색,a
train_2848,train/train_2848.jpg,이 사진에서 볼 수 없는 것은 무엇인가요?,파란 하늘과 구름이 있다,작은 배들이 항구에 정박해 있다,차들이 도로를 따라 주차되어 있다,사람들이 해변에서 수영하고 있다,d
train_2849,train/train_2849.jpg,사진에 보이는 음료는 무엇일까요?,녹차 라떼,아메리카노,카푸치노,홍차,a
train_2850,train/train_2850.jpg,이 사진은 어디에서 찍힌 것일 가능성이 가장 높은가요?,호수에서,강에서,수족관에서,바다에서,c
train_2851,train/train_2851.jpg,이 사진에 보이는 동물은 무엇인가요?,펭귄,상어,바다거북,돌고래,a
train_2852,train/train_2852.jpg,이 사진은 어디에서 촬영된 것일 가능성이 가장 높은가요?,수영장,강가,수족관,바다,c
train_2853,train/train_2853.jpg,이 사진 속 동물은 무엇인가요?,코끼리,바다사자,펭귄,사자,b
train_2854,train/train_2854.jpg,사진 속 손바닥 위에 놓인 것은 무엇인가요?,열쇠,작은 장난감 자동차,진짜 자동차,휴대폰,b
train_2855,train/train_2855.jpg,사진 속 동물의 색깔은 무엇인가요?,흰색,검은색,회색,갈색,b
train_2856,train/train_2856.jpg,사진 속 강아지가 누워있는 곳은 무엇인가요?,강아지 침대,강아지 장난감,강아지 집,강아지 밥그릇,a
train_2857,train/train_2857.jpg,이 사진에 보이는 구조물은 무엇인가요?,유람선,대교,등대,항구,b
train_2858,train/train_2858.jpg,이 사진에 보이는 다리는 무엇을 가로지르고 있나요?,도로,산,강,철도,c
train_2859,train/train_2859.jpg,사진 속 벤치 위에 앉아있는 새는 무엇인가요?,갈매기,펠리컨,오리,비둘기,b
train_2860,train/train_2860.jpg,이 진열대에서 판매하지 않는 음식은 무엇인가요?,샌드위치,아이스크림,치즈케이크,음료수,b
train_2861,train/train_2861.jpg,이 책상 위에 있는 물건이 아닌 것은 무엇인가요?,컴퓨터 마우스,텀블러,스테인리스 머그컵,책,d
train_2862,train/train_2862.jpg,사진 속 음식은 무엇인가요?,김밥과 된장국,비빔밥과 떡볶이,만두와 만두국,라면과 김치,c
train_2863,train/train_2863.jpg,사진 속 가게의 주요 업종은 무엇인가요?,식당,서점,화원,카페,c
train_2864,train/train_2864.jpg,이 사진에서 볼 수 없는 것은 무엇인가요?,눈,푸른 하늘,나무,고층 건물,a
train_2865,train/train_2865.jpg,사진 속 고양이는 어디에 있나요?,나무 위에 올라가 있다,바닥에 누워 있다,바구니 안에서 자고 있다,사람의 무릎 위에 앉아 있다,c
train_2866,train/train_2866.jpg,사진 속 강아지가 앉아있는 장소는 어디일까요?,해변,실내,산속,공원,d
train_2867,train/train_2867.jpg,이 사진에 있는 ATM은 어느 은행의 것인가요?,하나은행,국민은행,우리은행,신한은행,c
train_2868,train/train_2868.jpg,이 사진에 보이는 상품은 무엇인가요?,샐러드,음료수,과일,빵,a
train_2869,train/train_2869.jpg,이 이미지에서 판매되고 있는 케이크 종류가 아닌 것은 무엇인가요?,초코 베어 치즈토르테,리얼 스트로베리 쉬폰,스트로베리 쇼트케이크,치즈 케이크,d
train_2870,train/train_2870.jpg,사진 속 고양이들이 앉아 있는 장소는 어디인가요?,카페 앞,식당 앞,학교 앞,부동산 앞,d
train_2871,train/train_2871.jpg,이 사진에 보이는 인형이 들고 있는 것은 무엇인가요?,노란 별,파란 공,초록 나뭇잎,빨간 하트,d
train_2872,train/train_2872.jpg,이 사진에서 결제하고 있는 물건이 아닌 것은 무엇인가요?,블루베리 요거트 파르페,과자,감자칩,전자담배,d
train_2873,train/train_2873.jpg,이 사진에서 보이는 음료와 디저트는 무엇인가요?,주스와 과일,커피와 케이크,아이스크림과 쉐이크,차와 쿠키,c
train_2874,train/train_2874.jpg,이 가게 앞에 놓인 화환들은 주로 어떤 축하의 의미로 보이나요?,생일 축하,개업 축하,결혼 축하,졸업 축하,b
train_2875,train/train_2875.jpg,벽에 걸린 시계가 가리키는 시간은 무엇인가요?,오후 7시 25분,오후 5시 30분,오후 6시 25분,오후 6시 30분,c
train_2876,train/train_2876.jpg,이 식판에서 밥 위에 뿌려진 것은 무엇인가요?,참기름,고추가루,소금,검은 깨,d
train_2877,train/train_2877.jpg,이 나무 빗은 어느 시대에 만들어졌나요?,조선 시대,고려 시대,신라 시대,삼국 시대,b
train_2878,train/train_2878.jpg,이 음식은 무엇인가요?,떡볶이,냉면,비빔밥,김치찌개,b
train_2879,train/train_2879.jpg,사진 속 고양이의 색깔 조합은 무엇인가요?,갈색과 흰색,회색과 검은색,검은색과 흰색,주황색과 흰색,c
train_2880,train/train_2880.jpg,이 노트북의 브랜드는 무엇인가요?,레노버,삼성,애플,델,b
train_2881,train/train_2881.jpg,이 사진에 보이는 음식은 무엇인가요?,삼겹살,갈비,꼬치구이,불고기,c
train_2882,train/train_2882.jpg,이 건물 출입과 관련하여 무엇이 금지되어 있나요?,음주하는 것,쓰레기를 버리는 것,허가 없이 출입하는 것,자전거 타는 것,c
train_2883,train/train_2883.jpg,이 사진 속에서 무엇을 구워 먹고 있나요?,소고기,닭고기,삼겹살,오징어,c
train_2884,train/train_2884.jpg,이 음식은 무엇인가요?,김치찌개,불고기,돈까스 정식,비빔밥,c
train_2885,train/train_2885.jpg,이 사진에서 보이는 음식 중 떡볶이와 함께 있는 튀김은 무엇인가요?,고추전,김치전,파전,버섯전,d
train_2886,train/train_2886.jpg,이 음식들 중 떡볶이에 들어있는 주 재료는 무엇일까요?,밥,떡,김밥,튀김,b
train_2887,train/train_2887.jpg,이 이미지에 보이는 꽃들은 어떤 재료로 만들어졌나요?,플라스틱,종이,실로 뜨개질,유리,c
train_2888,train/train_2888.jpg,이 사진 속 작은 인형은 무엇을 먹고 있나요?,사과,바나나,아이스크림,초콜릿,c
train_2889,train/train_2889.jpg,이 사진에서 보이는 음료는 무엇인가요?,망고 스무디와 아이스 아메리카노,딸기 스무디와 핫커피,바나나 쉐이크와 아이스티,오렌지 주스와 아이스 라떼,a
train_2890,train/train_2890.jpg,이 사진에 보이는 케이크의 주 재료는 무엇인가요?,딸기와 키위,초콜릿과 바닐라,바나나와 망고,사과와 블루베리,a
train_2891,train/train_2891.jpg,이미지에 등장하는 동물은 무엇인가요?,햄스터,토끼,프레리도그,다람쥐,c
train_2892,train/train_2892.jpg,이 사진 속 강아지가 입고 있는 옷의 색깔은 무엇인가요?,노란색,파란색,빨간색,초록색,c
train_2893,train/train_2893.jpg,이 사진에 보이는 다리는 어디에 위치해 있나요?,서울,대구,인천,부산,d
train_2894,train/train_2894.jpg,이 사진에 나오는 동물은 무엇인가요?,소,돼지,말,양,a
train_2895,train/train_2895.jpg,이 사진에서 고양이가 앉아 있는 곳은 어디인가요?,풀밭 위,창문 앞,나무 아래,길가,a
train_2896,train/train_2896.jpg,이 사진에 보이는 작은 조각상은 무엇을 나타내고 있나요?,작은 동자승,불상,돌부처,석가모니,a
train_2897,train/train_2897.jpg,책상 위에 보이지 않는 것은 무엇인가요?,책,마우스,노트북,컵,a
train_2898,train/train_2898.jpg,사진 속 의자 위에 올라가 있는 동물은 무엇인가요?,햄스터,토끼,고양이,강아지,d
train_2899,train/train_2899.jpg,이 사진에서 벽에 설치된 두 개의 빨간색 기구는 무엇인가요?,소화전,소화기,비상벨,소화 호스,b
train_2900,train/train_2900.jpg,이 사진에 보이는 동물은 무엇인가요?,나비,개미,벌,달팽이,d
train_2901,train/train_2901.jpg,사진 속 책상 위에 보이는 음료수는 어떤 종류인가요?,페트병 음료,유리병 음료,플라스틱 컵에 담긴 음료,캔 음료,c
train_2902,train/train_2902.jpg,사진 속 병의 브랜드 이름은 무엇인가요?,게토레이,레드불,미에로화이바,비타500,d
train_2903,train/train_2903.jpg,이 사진에서 보이는 음식이 아닌 것은 무엇인가요?,햄버거,감자튀김,피자,스파게티,d
train_2904,train/train_2904.jpg,사진 속 음료 중 앞에 있는 노란색 음료에 장식된 과일은 무엇일까요?,레몬,오렌지,키위,패션프루트,d
train_2905,train/train_2905.jpg,이 사진에서 사람들이 주로 어디에 모여 있나요?,산 정상,해변과 바다 주변,도시 공원,쇼핑몰 내부,b
train_2906,train/train_2906.jpg,이 사진에서 보여지는 공간은 주로 무엇을 위한 장소인가요?,카페,도서관,게이밍 체험 공간,영화 감상 공간,c
train_2907,train/train_2907.jpg,사진 속 음식의 주 재료는 무엇인가요?,닭고기,새우,소고기,두부,b
train_2908,train/train_2908.jpg,이 사진에 보이는 천장 구조물 중 조명 기구는 어느 것인가요?,검은색 배관,네모난 환기구,동그란 원형 조명,둥근 스피커,c
train_2909,train/train_2909.jpg,이 침대 위에 올려진 타월은 무엇을 형상화한 것일까요?,거북이,게,문어,새우,b
train_2910,train/train_2910.jpg,이 사진에서 볼 수 있는 건물 중 가장 높은 것은 무엇인가요?,하얀색 호텔 건물,도로변의 야자수,뜨거운 태양 아래 해변가,고층 유리 건물,d
train_2911,train/train_2911.jpg,이 사진에서 보이는 두 대의 이동 수단은 무엇인가요?,자전거 두 대,자동차와 자전거,자전거와 전동킥보드,오토바이와 전동킥보드,c
train_2912,train/train_2912.jpg,사진 속 음료수 중 뚜껑이 열린 것은 무엇인가요?,초록색 음료,플라스틱 컵,모두 뚜껑이 닫혀 있음,오렌지색 병 음료,d
train_2913,train/train_2913.jpg,이 사진에서 노란색 전동 킥보드는 어디에 세워져 있나요?,잔디밭 위에,인도 위에,차도 위에,횡단보도 위에,b
train_2914,train/train_2914.jpg,이 이미지에 보이는 음식은 무엇인가요?,치킨,햄버거,샐러드,한명 피자,d
train_2915,train/train_2915.jpg,사진 속에 보이는 과일 맛 젤리는 어떤 과일 맛인가요?,딸기 맛,포도 맛,복숭아 맛,사과 맛,c
train_2916,train/train_2916.jpg,사진 속 음료 중 거품이 있는 녹색 음료는 무엇일까요?,탄산수,에스프레소,아메리카노,녹차 라떼,d
train_2917,train/train_2917.jpg,사진에 보이는 음식은 무엇인가요?,만두,김밥,스프링롤,초밥,c
train_2918,train/train_2918.jpg,이 사진에 보이는 음료 중 하나는 무엇인가요?,버블티,오렌지 주스,녹차,아메리카노,a
train_2919,train/train_2919.jpg,이 사진에 보이는 흰색 가전제품은 무엇인가요?,정수기,냉장고,세탁기,에어컨,d
train_2920,train/train_2920.jpg,이 전시 공간에서 주로 홍보하는 제품은 무엇인가요?,게임용 모니터,스마트폰,노트북,스피커,a
train_2921,train/train_2921.jpg,사진 속 자전거는 어떤 종류인가요?,접이식 자전거,일반 자전거,전기 자전거,산악 자전거,c
train_2922,train/train_2922.jpg,이 사진 속 빨간 기둥의 용도는 무엇일까요?,우체통,신호등,가로등,소화전,d
train_2923,train/train_2923.jpg,다음 중 이 도시락에 포함되어 있지 않은 초밥은 무엇인가요?,장어초밥,김치초밥,연어초밥,새우초밥,b
train_2924,train/train_2924.jpg,사진 속 고양이는 무엇을 하고 있나요?,길가에 앉아 있다,공을 잡고 있다,잔디를 바라보고 있다,자전거를 타고 있다,c
train_2925,train/train_2925.jpg,이 이미지에서 제공되는 아이템이 아닌 것은 무엇인가요?,검은색 총 3개,폭탄 3개,삽 3개,무한 하트 3시간,a
train_2926,train/train_2926.jpg,이 사진에 보이는 것은 무엇인가요?,책들이 꽂혀 있는 책장,접혀서 정리된 옷,음식이 담긴 그릇,신발이 가지런히 놓인 선반,b
train_2927,train/train_2927.jpg,이 제품에 그려진 캐릭터는 누구인가요?,미키 마우스,도날드 덕,플루토,구피,a
train_2928,train/train_2928.jpg,이 사진에서 가장 가까이 보이는 식물은 무엇인가요?,대나무,소나무,단풍나무,참나무,b
train_2929,train/train_2929.jpg,이 사진에서 볼 수 있는 야경은 무엇인가요?,도시의 야경,불꽃놀이,별이 빛나는 하늘,해변의 파도,b
train_2930,train/train_2930.jpg,이 사진에 보이는 강은 어디일까요?,낙동강,한강,금강,영산강,b
train_2931,train/train_2931.jpg,사진 속 두 마리 동물은 무엇일까요?,고양이,토끼,강아지,여우,a
train_2932,train/train_2932.jpg,이 이미지에 있는 캐릭터는 무엇의 인형인가요?,짱구,슈퍼 마리오 시리즈,포켓몬,디즈니 캐릭터,b
train_2933,train/train_2933.jpg,사진 속 고양이들이 주로 하고 있는 행동은 무엇인가요?,햇볕을 쬐고 있다,음식을 먹고 있다,잠을 자고 있다,산책을 하고 있다,a
train_2934,train/train_2934.jpg,이 사진에 보이는 가방의 주요 색상은 무엇인가요?,파란색과 분홍색,빨간색과 노란색,검은색과 주황색,초록색과 흰색,d
train_2935,train/train_2935.jpg,이 사진 속 건너편으로 건너가기 위해 밟는 것은 무엇인가요?,나무다리,돌다리,철교,다리,b
train_2936,train/train_2936.jpg,이 사진에 보이는 건물 이름은 무엇인가요?,장미주택 D,장미빌라 C,장미타운 B,장미아파트 A,c
train_2937,train/train_2937.jpg,사진 속 빨간 표지판에 적힌 문구는 무엇인가요?,출입금지,차량통제,주차금지,정지선,c
train_2938,train/train_2938.jpg,이 사진에 나오는 동물은 무엇인가요?,참새,비둘기,오리,닭,b
train_2939,train/train_2939.jpg,사진 속 음식 중 일본 요리는 무엇인가요?,닭강정,핫도그,떡볶이,초밥,d
train_2940,train/train_2940.jpg,이 이미지에 보이는 신발 브랜드는 무엇인가요?,나이키,컨버스,뉴발란스,아디다스,b
train_2941,train/train_2941.jpg,이 이미지에 있는 제품들은 주로 무엇을 위한 장난감인가요?,퍼즐 맞추기 장난감,블록 쌓기 장난감,자동차 장난감,비눗방울 놀이를 위한 장난감,d
train_2942,train/train_2942.jpg,이 사진에서 보이는 새는 무엇인가요?,참새,독수리,갈매기,비둘기,c
train_2943,train/train_2943.jpg,이 사진 속 동물은 무엇인가요?,개구리,물고기,오리,거북이,c
train_2944,train/train_2944.jpg,이 사진에서 주로 볼 수 있는 자연 요소는 무엇인가요?,바다,호수,사막,산과 나무,d
train_2945,train/train_2945.jpg,이 사진에 보이는 음식은 무엇인가요?,떡볶이,오뎅(어묵) 국물,순대,김밥,b
train_2946,train/train_2946.jpg,이 사진 속 액자 안에 있는 것은 무엇인가요?,텔레비전,CD 플레이어,레코드판,라디오,c
train_2947,train/train_2947.jpg,사진 속 캐릭터는 무엇인가요?,곰,토끼,고양이,강아지,d
train_2948,train/train_2948.jpg,이 사진에 등장하는 캐릭터는 무엇인가요?,포켓몬의 피카츄,월레스와 그로밋의 그로밋,도라에몽,스누피,b
train_2949,train/train_2949.jpg,이 음식은 무엇으로 만든 일본 요리인가요?,돈부리,장어덮밥,라멘,초밥,b
train_2950,train/train_2950.jpg,이 건물의 용도는 무엇일까요?,도서관,학교,병원,교회,d
train_2951,train/train_2951.jpg,이 사진에서 보이는 건축물은 무엇인가요?,서양식 성당,현대식 아파트,한옥,고층 빌딩,c
train_2952,train/train_2952.jpg,이 사진 속에서 보이는 높은 건물은 무엇인가요?,남산타워,63빌딩,롯데월드타워,서울시청,c
train_2953,train/train_2953.jpg,이 음식의 주요 재료로 알맞은 것은 무엇인가요?,돼지고기와 양배추,닭고기와 당근,두부와 시금치,생 연어와 생 소고기,d
train_2954,train/train_2954.jpg,이 제품은 어떤 맛의 아이스티인가요?,복숭아 맛,자두 맛,레몬 맛,사과 맛,a
train_2955,train/train_2955.jpg,이 음식의 주된 국물 색깔은 무엇인가요?,초록색,빨간색,노란색,갈색,b
train_2956,train/train_2956.jpg,이 사진에서 두 사람이 하고 있는 손 모양은 무엇일까요?,주먹을 쥐고 있다,엄지손가락을 치켜세우고 있다,손바닥을 펴고 있다,브이(V) 표시를 하고 있다,d
train_2957,train/train_2957.jpg,천장에 설치된 모니터 하단에 붙어 있는 빨간색 표지판의 문구는 무엇인가요?,낙하 주의,출입 금지,머리 조심,화재 경고,c
train_2958,train/train_2958.jpg,책상 위에 올려져 있지 않은 것은 무엇인가요?,키보드,노트북,슬리퍼,컴퓨터 마우스,c
train_2959,train/train_2959.jpg,사진 속에 보이는 신발은 어떤 종류인가요?,구두,부츠,슬리퍼,운동화,c
train_2960,train/train_2960.jpg,사진 속 제품은 무엇인가요?,충전기,휴대폰,무선 이어폰 케이스,노트북,c
train_2961,train/train_2961.jpg,이 사진에 보이는 노트북에 붙어있는 스티커 중 올바른 것은 무엇인가요?,Qualcomm Snapdragon,Intel Evo i7,Apple M1,AMD Ryzen 7,b
train_2962,train/train_2962.jpg,이 사진에 보이는 전자기기 브랜드는 무엇인가요?,델,애플,LG,삼성,d
train_2963,train/train_2963.jpg,이미지에 보이는 마우스 브랜드는 무엇인가요?,삼성,애플,LG,델,a
train_2964,train/train_2964.jpg,삼성청년SW·AI아카데미의 교육 중 건강 이상 시 어떻게 해야 하나요?,학사시스템에 입/퇴실 체크를 한다,단정한 복장을 착용한다,퇴실 전 노트북을 정돈한다,즉시 담당 프로에게 연락한다,d
train_2965,train/train_2965.jpg,이 방에서 볼 수 없는 것은 무엇인가요?,벽 그림,커튼,침대,책상,d
train_2966,train/train_2966.jpg,이 이미지에 보이는 상품들은 주로 어떤 주제로 만들어졌나요?,동물과 야생,도시 풍경,자연과 식물,음식과 요리,c
train_2967,train/train_2967.jpg,이 사진 속 인형뽑기 기계 안에 들어있는 인형은 무엇인가요?,곰 인형,고양이 인형,강아지 인형,토끼 인형,d
train_2968,train/train_2968.jpg,가방에 달려 있는 인형은 어떤 동물 모양인가요?,고양이,토끼,곰,강아지,b
train_2969,train/train_2969.jpg,사진 속 아이스크림의 색깔은 무엇인가요?,초록색,노란색,분홍색,보라색,d
train_2970,train/train_2970.jpg,이 사진에서 보이는 하늘의 색깔은 무엇인가요?,파란색과 흰색,회색과 검은색,노란색과 초록색,분홍색과 주황색,d
train_2971,train/train_2971.jpg,이 사진은 어느 장소에서 촬영된 것일까요?,도쿄 시부야 스크램블 교차로,뉴욕 타임스퀘어,파리 에펠탑 근처,서울 명동 거리,a
train_2972,train/train_2972.jpg,이 거리에서 보이는 주요 특징은 무엇인가요?,자동차가 많이 다니는 도로이다,숲속 산책로이다,사람들이 많이 걷는 쇼핑 거리이다,조용한 주택가이다,c
train_2973,train/train_2973.jpg,이 사진에 보이는 음료는 무엇일까요?,우유,차,커피,주스,c
train_2974,train/train_2974.jpg,이 사진에 보이는 음식은 무엇인가요?,떡볶이,김밥,꼬치구이,비빔밥,c
train_2975,train/train_2975.jpg,이 사진에 보이는 음식은 무엇인가요?,치즈 롤,생선 케이크,계란말이,마시멜로우,d
train_2976,train/train_2976.jpg,이 음식은 무엇인가요?,라면,떡볶이,소고기국밥,비빔밥,c
train_2977,train/train_2977.jpg,이 사진에 있는 캐릭터는 무엇인가요?,짱구,포켓몬 피카츄,토토로,도라에몽,c
train_2978,train/train_2978.jpg,이 사진에 보이는 전통 건축물은 무엇인가요?,중국의 자금성,한국의 한옥,몽골의 게르,일본의 성,d
train_2979,train/train_2979.jpg,이 음식은 무엇인가요?,순두부찌개,칼국수,콩국수,설렁탕,b
train_2980,train/train_2980.jpg,이 사진은 어느 나라의 도시 거리인가요?,한국,대만,일본,중국,c
train_2981,train/train_2981.jpg,이 사진에서 보이는 거리는 어떤 종류의 장소인가요?,주거 지역,공원 산책로,쇼핑 거리,공항 터미널,c
train_2982,train/train_2982.jpg,이 사진은 어디에서 촬영된 것일까요?,버스 정류장,지하철 역,기차역,공항 터미널,b
train_2983,train/train_2983.jpg,이 사진은 어느 나라의 도시 야경을 찍은 것일까요?,태국,중국,일본,한국,c
train_2984,train/train_2984.jpg,이 이미지에서 버스 정류장 표지판에 적혀 있는 글자는 무엇인가요?,겨울방학입구,가을방학입구,여름방학입구,봄방학입구,c
train_2985,train/train_2985.jpg,사진 속 사람들이 손에 들고 있는 음식은 무엇인가요?,아이스크림,샐러드,케이크,아메리카노,a
train_2986,train/train_2986.jpg,사진 속 동물은 무엇인가요?,회색 강아지,검은 고양이,갈색 토끼,하얀 비둘기,b
train_2987,train/train_2987.jpg,이 작은 유리병 안에 있는 캐릭터들은 무엇과 관련이 있나요?,젤다,피크민,포켓몬,마리오,b
train_2988,train/train_2988.jpg,이 사진은 어떤 장소에서 촬영된 것일까요?,카페나 바 내부,도서관,학교 강의실,병원 대기실,a
train_2989,train/train_2989.jpg,이 사진에 있는 음식은 무엇인가요?,스파게티,샌드위치,햄버거,피자,d
train_2990,train/train_2990.jpg,이 사진에서 보이는 음식은 무엇인가요?,바나나와 토스트,피자와 감자튀김,초콜릿과 케이크,과일 샐러드,a
train_2991,train/train_2991.jpg,이 사진에 보이는 음식은 무엇인가요?,치킨 윙,스파게티,초밥,피자,a
train_2992,train/train_2992.jpg,이 사진에서 보이는 첨탑에 달려있는 것은 무엇인가요?,달,별,연꽃,십자가,d
train_2993,train/train_2993.jpg,이미지에서 볼 수 있는 디저트 뷔페의 특징은 무엇인가요?,야외에서 열리고 있다,모두 초콜릿으로만 만들어져 있다,음료만 제공된다,다양한 종류의 디저트가 진열되어 있다,d
