id,path,question,a,b,c,d,answer
train_0994,train/train_0994.jpg,이 사진에 보이는 음료와 디저트는 무엇입니까?,라떼와 과일 케이크,오렌지 주스와 초콜릿 케이크,아이스커피와 크리스마스 케이크,아이스티와 치즈 케이크,c
train_0995,train/train_0995.jpg,이 사진에 보이는 케이크 위에 장식된 모양은 무엇인가요?,당근,딸기,사과,바나나,a
train_0996,train/train_0996.jpg,이 건물은 무엇인가요?,학교,교회,박물관,도서관,b
train_0997,train/train_0997.jpg,이 사진에 보이는 음료는 무엇인가요?,아이스커피,레모네이드,뜨거운 차,오렌지 주스,a
train_0998,train/train_0998.jpg,이 사진에 보이는 곰 모양 디저트는 어떤 재료로 만들어졌을 가능성이 가장 높은가요?,딸기 젤리,치즈,바닐라 아이스크림,초콜릿,d
train_0999,train/train_0999.jpg,이 사진에서 보이는 주된 풍경은 무엇인가요?,도시의 야경,일몰과 강 위의 배,산과 숲,사막과 오아시스,b
train_1000,train/train_1000.jpg,이 사진 속에서 보이는 음료는 무엇인가요?,주스,커피,우유,차,b
train_1001,train/train_1001.jpg,이 사진에 보이는 건물은 어디에 위치한 유명한 건물일까요?,프랑스 파리,영국 런던,이탈리아 로마,스페인 마드리드,a
train_1002,train/train_1002.jpg,이 사진에서 사람들이 기다리고 있는 장소는 어디일까요?,지하철 입구,횡단보도 건너기 전 대기 장소,버스 정류장,카페 앞,b
train_1003,train/train_1003.jpg,이 사진에서 보이는 꽃의 색깔은 무엇인가요?,노란색,파란색,분홍색,빨간색,c
train_1004,train/train_1004.jpg,이 사진에 보이는 유명한 건축물은 무엇인가요?,피사의 사탑,에펠탑,빅벤,자유의 여신상,b
train_1005,train/train_1005.jpg,이 사진에 보이는 동상은 무엇을 나타내고 있나요?,사람이 말을 타고 있는 모습,새가 날고 있는 모습,사자가 있는 동상,꽃이 피어있는 조각,a
train_1006,train/train_1006.jpg,이 사진에 보이는 유명한 건축물은 무엇인가요?,빅벤,에펠탑,피사의 사탑,자유의 여신상,b
train_1007,train/train_1007.jpg,이 사진에 보이는 유명한 건축물은 무엇인가요?,피사의 사탑,자유의 여신상,에펠탑,빅벤,c
train_1008,train/train_1008.jpg,사진 속 병에 담긴 음료수 브랜드는 무엇인가요?,펩시,스프라이트,코카콜라,비텔,d
train_1009,train/train_1009.jpg,이 사진에 보이는 동상은 무엇을 나타내고 있나요?,천사상,건물,기마상,사자상,c
train_1010,train/train_1010.jpg,이 사진에 보이는 분수대가 위치한 장소는 어디일까요?,노트르담 대성당,베르사유 궁전,루브르 박물관,에펠탑,b
train_1011,train/train_1011.jpg,이 사진 속 두 사람이 손에 들고 있는 음료는 무엇일까요?,코카콜라,펩시,스프라이트,하이네켄 맥주,d
train_1012,train/train_1012.jpg,이 사진은 어디에서 촬영된 것일 가능성이 높을까요?,뉴욕 센트럴 파크,베르사유 궁전 정원,런던 하이드 파크,도쿄 우에노 공원,b
train_1013,train/train_1013.jpg,이 건물은 어디에 위치한 유명한 궁전인가요?,노트르담 대성당,루브르 박물관,에펠탑,베르사유 궁전,d
train_1014,train/train_1014.jpg,이 사진에 보이는 장소는 무엇인가요?,호수 근처 공원,실내 미술관,도시의 거리,산 정상,a
train_1015,train/train_1015.jpg,이 음식 사진에서 보이는 고기 요리 위에 올려진 것은 무엇인가요?,상추와 간장 소스,감자와 케첩,파슬리와 토마토 소스,양배추와 크림 소스,d
train_1016,train/train_1016.jpg,이 사진에 보이는 분수대 주변 환경으로 가장 알맞은 설명은 무엇인가요?,분수대는 도시 중심가의 붐비는 거리 한복판에 있다.,분수대 주변은 울창한 나무와 푸른 잔디가 잘 관리된 공원이다.,분수대 주변은 사막과 같은 건조한 환경이다.,분수대 주변은 모래사장과 야자수로 이루어진 해변이다.,b
train_1017,train/train_1017.jpg,이 사진 속 공원 중앙에 있는 것은 무엇인가요?,조각상,벤치,나무,분수,d
train_1018,train/train_1018.jpg,이 사진은 주로 어디에서 촬영된 것일까요?,음악회,미술관,영화 촬영장,운동 경기장,b
train_1019,train/train_1019.jpg,이 이미지에서 벽에 걸려 있는 그림 중에서 인물의 손 모양은 무엇인가요?,손을 벌리고 있음,손을 뒤로 감춤,손을 주먹 쥠,손을 모으고 있음,d
train_1020,train/train_1020.jpg,이 사진에서 사람들이 주로 무엇을 하고 있나요?,꽃과 식물을 구경하고 있다,사진을 찍지 않고 있다,운동을 하고 있다,음식을 먹고 있다,a
train_1021,train/train_1021.jpg,이 사진에서 보이는 음료에 가장 잘 어울리는 설명은 무엇인가요?,우유 한 잔,탄산음료,뜨거운 커피,얼음이 든 차가운 음료,d
train_1022,train/train_1022.jpg,이 사진에서 보이는 교통 표지판은 무엇을 의미하나요?,일방통행,주차금지,진입금지,속도제한,c
train_1023,train/train_1023.jpg,이 사진 속 도로의 바닥 재질은 무엇인가요?,콘크리트,자갈,포장용 벽돌,아스팔트,c
train_1024,train/train_1024.jpg,이 사진에 보이는 장소는 주로 무엇을 하는 곳인가요?,음식 축제,음악 공연장,농산물 직거래 장터,야외 미술 시장,d
train_1025,train/train_1025.jpg,이 사진은 어떤 날씨를 보여주고 있나요?,안개가 낀 날씨,눈이 오는 날씨,비가 오는 날씨,맑고 구름이 약간 낀 날씨,d
train_1026,train/train_1026.jpg,이 사진에 보이는 건물들의 특징으로 가장 적절한 것은 무엇인가요?,현대식 고층 빌딩,미래형 스마트 하우스,유럽풍의 오래된 건축 양식,전통 한옥 스타일,c
train_1027,train/train_1027.jpg,사진 속 길을 달리고 있는 교통수단은 무엇인가요?,버스,자전거,기차,자동차,c
train_1028,train/train_1028.jpg,이 사진에서 보이는 음료의 색깔 조합으로 알맞은 것은 무엇인가요?,파란색과 주황색,초록색과 주황색,노란색과 빨간색,파란색과 빨간색,a
train_1029,train/train_1029.jpg,이 사진에 보이는 유명한 건축물은 무엇인가요?,에펠탑,자유의 여신상,피사의 사탑,빅벤,a
train_1030,train/train_1030.jpg,이 사진에서 보이는 사람은 무엇을 하고 있나요?,자전거를 타고 있다,잔디밭을 바라보고 있다,나무를 심고 있다,공원에서 산책하고 있다,b
train_1031,train/train_1031.jpg,사진 속 피크닉 장소는 어디인가요?,산 정상,공원,도시 거리,해변,b
train_1032,train/train_1032.jpg,이 사진에 보이는 건축물은 무엇인가요?,파리의 개선문,로마의 콜로세움,바르셀로나의 사그라다 파밀리아,아테네의 파르테논,a
train_1033,train/train_1033.jpg,사진 속 강아지의 털 색깔은 무엇인가요?,검은색,회색,갈색,흰색,d
train_1034,train/train_1034.jpg,이 사진에서 보이는 도로 주변의 시설물은 무엇을 위해 설치된 것일까요?,주차 공간 확보를 위해,도로 공사를 위해,행사나 시위를 위해,자전거 도로 설치를 위해,c
train_1035,train/train_1035.jpg,이 사진은 어디에서 찍은 것일까요?,런던 아이,에펠탑,서울 남산타워,월트 디즈니 스튜디오 파크,d
train_1036,train/train_1036.jpg,이 사진에 찍힌 장소는 어디인가요?,픽사 스튜디오,유니버설 스튜디오,워너 브라더스 스튜디오,월트 디즈니 스튜디오,d
train_1037,train/train_1037.jpg,사진 속 풍선들의 모양은 무엇을 닮았나요?,아이언맨 헬멧,캡틴 아메리카 방패,스파이더맨 얼굴,배트맨 얼굴,c
train_1038,train/train_1038.jpg,사진 속에서 보이는 캐릭터들은 어떤 애니메이션에 등장하는 인물들인가요?,슈렉,겨울왕국,인크레더블,토이 스토리,c
train_1039,train/train_1039.jpg,이 분수대 위에 장식되어 있는 동물은 무엇인가요?,강아지,고양이,토끼,쥐,d
train_1040,train/train_1040.jpg,이 사진에 찍힌 장소는 어디일까요?,에버랜드,디즈니랜드,서울숲,롯데월드,b
train_1041,train/train_1041.jpg,이 사진에 보이는 음식 중 피자에 올려진 토핑은 무엇인가요?,버섯,페퍼로니,파인애플,양파,b
train_1042,train/train_1042.jpg,이 사진이 찍힌 장소는 어디일까요?,서울대공원,에버랜드,롯데월드,디즈니랜드,d
train_1043,train/train_1043.jpg,이 사진에서 보이는 사람들은 무엇을 하고 있나요?,자전거를 타고 있다,사진을 찍고 있다,산책을 하고 있다,음식을 먹고 있다,c
train_1044,train/train_1044.jpg,이 집 외벽에 많이 붙어 있는 식물은 무엇인가요?,국화,해바라기,담쟁이덩굴,장미,c
train_1045,train/train_1045.jpg,사진에 보이는 건물의 창문 색깔은 무엇인가요?,노란색,빨간색,초록색,파란색,c
train_1046,train/train_1046.jpg,이 사진은 어떤 장소에서 찍힌 것일까요?,도서관,미술관,음식점,운동장,b
train_1047,train/train_1047.jpg,이 사진의 배경은 어디일까요?,산 정상,꽃과 나무가 많은 정원,해변,도시 공원,b
train_1048,train/train_1048.jpg,이 사진에서 볼 수 없는 것은 무엇인가요?,호수 위의 수련,화창한 맑은 하늘,사람들이 걷는 길,꽃이 핀 정원,b
train_1049,train/train_1049.jpg,이 사진에 보이는 꽃은 무엇인가요?,해바라기,장미,백합,튤립,a
train_1050,train/train_1050.jpg,이 사진에 보이는 가게는 어떤 종류인가요?,서점,꽃집,카페 겸 레스토랑,옷가게,c
train_1051,train/train_1051.jpg,이 이미지에서 볼 수 없는 디저트는 무엇인가요?,바나나 케이크,초콜릿 무스 케이크,딸기 타르트,라즈베리 타르트,a
train_1052,train/train_1052.jpg,이 사진에 보이는 대형 광고판은 어떤 브랜드의 제품을 홍보하고 있나요?,애플,삼성,소니,샤오미,b
train_1053,train/train_1053.jpg,이 사진 속 도로의 끝에 보이는 유명한 건축물은 무엇인가요?,에펠탑,노트르담 대성당,개선문,루브르 박물관,c
train_1054,train/train_1054.jpg,이 사진에 보이는 유명한 건축물은 무엇인가요?,노트르담 대성당,에펠탑,개선문,루브르 박물관,c
train_1055,train/train_1055.jpg,이 사진에 보이는 유명한 건축물은 무엇인가요?,에펠탑,개선문,노트르담 대성당,루브르 박물관,b
train_1056,train/train_1056.jpg,이 사진에 보이는 천장의 특징은 무엇인가요?,천장이 없는 개방형 구조,평평한 콘크리트 천장,유리와 스테인드글라스로 이루어진 돔형 천장,나무로 만든 전통 한옥 천장,c
train_1057,train/train_1057.jpg,이 사진에서 보이는 붉은색 조형물은 무엇을 형상화하고 있나요?,비행기,나비,사람의 다리와 리본,꽃,c
train_1058,train/train_1058.jpg,이 이미지에서 주로 판매하는 음식 재료는 무엇인가요?,초콜릿,과일,트러플을 사용한 다양한 식품,해산물,c
train_1059,train/train_1059.jpg,이 사진에서 볼 수 없는 것은 무엇인가요?,사람,자동차,파란 하늘,바다,d
train_1060,train/train_1060.jpg,이 거리에서 볼 수 없는 것은 무엇인가요?,사람,자전거,식당,자동차,b
train_1061,train/train_1061.jpg,이 사진 속 카페에서 사용하는 의자 색깔은 무엇인가요?,초록색,파란색,빨간색,노란색,b
train_1062,train/train_1062.jpg,이 장소에서 사람들이 무엇을 하고 있나요?,공연을 보고 있다,쇼핑을 하고 있다,사진 촬영을 하고 있다,음식을 주문하기 위해 줄을 서고 있다,d
train_1063,train/train_1063.jpg,이 사진에서 보이는 건물의 주요 건축 재료는 무엇인가요?,유리와 철근,나무와 흙,돌과 벽돌,플라스틱과 금속,c
train_1064,train/train_1064.jpg,이 건물 앞에 보이는 다섯 개의 원은 무엇을 상징하나요?,유네스코,올림픽,국제 연합,유럽 연합,b
train_1065,train/train_1065.jpg,이 건물 외벽에 주로 보이는 파이프의 색깔은 무엇인가요?,보라색,빨간색,노란색,파란색,d
train_1066,train/train_1066.jpg,이 사진에 있는 동물은 무엇인가요?,오리와 아기 오리들,비둘기와 새끼 비둘기들,거위와 아기 거위들,닭과 병아리들,a
train_1067,train/train_1067.jpg,사진 속 사람들은 어디에 앉아 있나요?,공원 잔디,실내 체육관,학교 운동장,해변 모래사장,a
train_1068,train/train_1068.jpg,이 사진 속에서 보이는 것은 무엇인가요?,강과 나무,바다와 모래사장,사막과 선인장,산과 호수,a
train_1069,train/train_1069.jpg,사진 속 사람이 손에 들고 있는 음식은 무엇인가요?,프레첼,도넛,마카롱,크루아상,a
train_1070,train/train_1070.jpg,이 사진에서 벽에 그려진 곰돌이는 무엇을 들고 있나요?,버블티,우유,커피,주스,a
train_1071,train/train_1071.jpg,이 사진에 보이는 동상은 무엇을 나타내고 있나요?,자연 풍경 조각상,역사적 인물의 흉상,추상적인 현대 미술 작품,동물 조각상,b
train_1072,train/train_1072.jpg,사진에 있는 음식 중 홍합이 들어간 요리는 무엇인가요?,흰 쌀밥,새우 카레,빈 양동이,홍합찜,d
train_1073,train/train_1073.jpg,이 사진은 어디에서 촬영된 것일까요?,드론으로 촬영한 도시 전경,비행기 창문 밖에서 촬영한 도시 전경,고층 빌딩 옥상에서 촬영한 도시 전경,산 정상에서 촬영한 도시 전경,b
train_1074,train/train_1074.jpg,이 사진의 배경에 보이는 건물 중에 공용 사무실 공간을 제공하는 회사는 어디인가요?,Amer Group,BOC,GuocoLand,wework,d
train_1075,train/train_1075.jpg,이 사진에 보이는 유명한 건물은 어디에 있나요?,서울,싱가포르,도쿄,뉴욕,b
train_1076,train/train_1076.jpg,이 사진 속에 보이는 독특한 인공 구조물은 어디에 위치해 있나요?,방콕,싱가포르,도쿄,서울,b
train_1077,train/train_1077.jpg,이 사진에서 보이는 캐릭터들은 무엇과 관련이 있나요?,드래곤볼,디즈니,포켓몬,마블,c
train_1078,train/train_1078.jpg,사진 속 음료는 무엇인가요?,커피,주스,우유,맥주,d
train_1079,train/train_1079.jpg,사진 속 붉은색 차량은 어떤 용도로 주로 사용될까요?,관광용 미니 기차,소방차,택배 차량,택시,a
train_1080,train/train_1080.jpg,이 사진에 보이는 건물은 무엇인가요?,박물관,학교,성당,공원,c
train_1081,train/train_1081.jpg,이 사진에 보이는 분수는 어디에 위치해 있나요?,"로마, 이탈리아","베를린, 독일","바르셀로나, 스페인","파리, 프랑스",a
train_1082,train/train_1082.jpg,이 사진의 중심에 있는 기념물은 무엇인가요?,자유의 여신상,오벨리스크,피사의 사탑,에펠탑,b
train_1083,train/train_1083.jpg,이 사진 속에 보이는 건축물은 무엇인가요?,근대식 아파트,대형 쇼핑몰,교회 종탑,현대 미술관,c
train_1084,train/train_1084.jpg,이 사진에 보이는 건물은 무엇인가요?,콜로세움,바티칸 박물관 입구,로마 포럼,판테온,b
train_1085,train/train_1085.jpg,이 조각상이 들고 있는 무기는 무엇인가요?,방패,활과 화살,창,칼,b
train_1086,train/train_1086.jpg,이 조각상은 무엇을 묘사하고 있나요?,로마 황제의 초상,중세 시대의 전투 장면,라오콘과 그의 아들들이 뱀에게 공격당하는 장면,그리스 신화의 제우스 신,c
train_1087,train/train_1087.jpg,이 사진에 보이는 거리의 주요 특징은 무엇인가요?,차들이 많이 지나가는 대로변이다.,사람들이 많이 모여 있는 번화한 거리이다.,한적한 주택가의 골목길이다.,산과 자연이 많은 시골길이다.,b
train_1088,train/train_1088.jpg,이 음식 사진에 보이는 튀김은 무엇인가요?,감자튀김,치킨너겟,오징어튀김,고구마튀김,a
train_1089,train/train_1089.jpg,이 건물의 이름은 무엇인가요?,사그라다 파밀리아,카사 바트요,카사 밀라,구엘 공원,b
train_1090,train/train_1090.jpg,이 사진에서 보이는 건물은 어떤 스타일의 건축물일까요?,고전 유럽식 건축,일본 전통 건축,현대식 고층 빌딩,중세 아시아 사원,a
train_1091,train/train_1091.jpg,이 사진 속 건물은 무엇인가요?,박물관,학교,도서관,교회,d
train_1092,train/train_1092.jpg,사진 속에 보이는 건축물은 어떤 종류의 건물일까요?,박물관,성당,공공도서관,학교,b
train_1093,train/train_1093.jpg,이 축구 유니폼은 어느 팀의 것인가요?,맨체스터 유나이티드,유벤투스,레알 마드리드,바이에른 뮌헨,d
train_1094,train/train_1094.jpg,이 사진에서 사람들이 앉아 있는 것은 무엇인가요?,돌로 만든 의자,철제 의자,나무 벤치,플라스틱 의자,a
train_1095,train/train_1095.jpg,이 사진에서 보이는 새는 무엇인가요?,갈매기,비둘기,백조,오리,d
train_1096,train/train_1096.jpg,이 사진에서 볼 수 없는 것은 무엇인가요?,호수,산,집,나무,b
train_1097,train/train_1097.jpg,이 사진에서 보이는 물가의 바위 주변 상황으로 가장 알맞은 설명은 무엇인가요?,물이 흐르지 않고 고여 있지 않다,물이 일부 말라 바위가 드러나 있다,물이 완전히 마른 상태이다,물이 가득 차서 바위가 잠겨 있다,b
train_1098,train/train_1098.jpg,이 사진에서 볼 수 없는 것은 무엇인가요?,사람들이 걷고 있다,오리들이 잔디밭에 있다,눈이 쌓여 있다,조각상들이 줄지어 서 있다,c
train_1099,train/train_1099.jpg,이 건물의 용도는 무엇인가요?,도서관,박물관,성당,학교,c
train_1100,train/train_1100.jpg,이 음식은 무엇인가요?,비빔밥,떡볶이,유부초밥,김밥,c
train_1101,train/train_1101.jpg,이 건물은 무엇으로 보이나요?,대학교,박물관,기차역,도서관,c
train_1102,train/train_1102.jpg,이 사진에 보이는 기념비의 꼭대기에 있는 것은 무엇인가요?,대리석 조각상,황금색 여성상,나무 조각,비둘기 모양,b
train_1103,train/train_1103.jpg,이 사진 속 나무는 무엇을 기념하기 위해 장식된 것일까요?,추석,크리스마스,설날,할로윈,b
train_1104,train/train_1104.jpg,이 사진에 보이는 깃발은 어느 나라의 국기인가요?,프랑스,벨기에,네덜란드,룩셈부르크,d
train_1105,train/train_1105.jpg,이 사진 속 곰 조각상에 적힌 도시는 어디인가요?,뉴욕,파리,런던,베를린,d
train_1106,train/train_1106.jpg,이 이미지에 등장하는 노란색 곰 캐릭터는 어떤 브랜드를 대표하나요?,롯데,해태,HARIBO,오리온,c
train_1107,train/train_1107.jpg,이 사진에서 인형이 주로 어디에 놓여 있나요?,사람들 주변,가게 입구 앞,가로등 아래,자전거 옆,a
train_1108,train/train_1108.jpg,이 음식 중에서 일본 음식은 무엇일까요?,우동,튀김 롤 초밥,샐러드,국수,b
train_1109,train/train_1109.jpg,이 축구 경기장에서 관중들이 흔들고 있는 국기는 어느 나라의 국기일까요?,스페인,프랑스,터키,독일,c
train_1110,train/train_1110.jpg,이 도로 표지판에 따르면 Alexanderplatz로 가려면 어떤 방향으로 가야 하나요?,직진해야 한다,유턴해야 한다,오른쪽으로 가야 한다,왼쪽으로 가야 한다,a
train_1111,train/train_1111.jpg,이 사진 속 강 주변에서 볼 수 없는 것은 무엇일까요?,자동차,건물,배,나무,a
train_1112,train/train_1112.jpg,벽화에 그려진 인물 중 과학자로 유명한 사람은 누구인가요?,알려지지 않음,J. W. Goethe,F. Schiller,A. Einstein,d
train_1113,train/train_1113.jpg,이 이미지에서 주로 보이는 상품은 무엇과 관련이 있나요?,반지의 제왕,디즈니,스타워즈,해리포터,d
train_1114,train/train_1114.jpg,이 사진이 찍힌 장소의 주된 테마는 무엇일까요?,현대 미술 전시관,음악 공연장,스포츠 용품점,해리 포터와 판타지,d
train_1115,train/train_1115.jpg,이 사진에서 볼 수 있는 야간 거리의 특징은 무엇인가요?,거리에 자동차가 많이 다닌다,사람들이 모두 모자를 쓰고 있다,거리 위에 화려한 조명이 걸려 있다,거리가 텅 비어 있다,c
train_1116,train/train_1116.jpg,이 글에서 동물의 눈을 볼 때 느끼는 감정이 아닌 것은 무엇인가요?,두려움을 느낌,친구를 봄,영혼을 느낌,살아있는 존재를 봄,a
train_1117,train/train_1117.jpg,이 상점에서 판매하는 물건은 무엇인가요?,장갑,양말,모자,손가락 인형,d
train_1118,train/train_1118.jpg,이 사진에 있는 곰 인형들은 주로 어떤 도시와 관련이 있나요?,런던,파리,도쿄,뉴욕,a
train_1119,train/train_1119.jpg,이 사진에 보이는 기념비는 무엇을 기념하기 위한 것일까요?,자연 보호를 위한 기념비,예술가들을 기리는 기념비,과학자들의 업적을 기념하는 기념비,전쟁과 군인의 희생을 기념하는 기념비,d
train_1120,train/train_1120.jpg,이 사진에서 볼 수 없는 것은 무엇인가요?,크리스마스 양말,공룡 인형,눈사람 장식,공룡 무늬 스웨터,c
train_1121,train/train_1121.jpg,이 사진에 보이는 유명한 건축물은 무엇인가요?,빅벤,에펠탑,자유의 여신상,피사의 사탑,b
train_1122,train/train_1122.jpg,이 건축물의 지붕 위에 있는 십자가는 무엇을 상징하나요?,이슬람교,기독교,힌두교,불교,b
train_1123,train/train_1123.jpg,사진 속 분수대 주변에 있는 것은 무엇인가요?,놀이터,자전거,자동차,벤치,d
train_1124,train/train_1124.jpg,이 미술 작품에서 조각상들이 주로 어떻게 배치되어 있나요?,벽에 기대어 있음,천장에 매달려 거꾸로 있음,바닥에 누워 있음,모두 서 있음,b
train_1125,train/train_1125.jpg,이 무덤은 누구의 무덤일까요?,샤를 드 골,루이 14세,조셉 나폴레옹 1세,나폴레옹 보나파르트,c
train_1126,train/train_1126.jpg,이 사진에 보이는 물건은 무엇인가요?,비행기,자전거,대포,자동차,c
train_1127,train/train_1127.jpg,이 사진에 보이는 유명한 건축물은 무엇인가요?,자유의 여신상,피사의 사탑,빅벤,에펠탑,d
train_1128,train/train_1128.jpg,이 사진에 보이는 유명한 건물은 무엇인가요?,자유의 여신상,에펠탑,빅벤,피사의 사탑,b
train_1129,train/train_1129.jpg,이 사진에서 볼 수 있는 계절과 관련된 장식은 무엇인가요?,여름 해변 장식,봄꽃 장식,크리스마스 조명,할로윈 호박 장식,c
train_1130,train/train_1130.jpg,이 사진에서 볼 수 있는 것은 무엇인가요?,사람들이 해변에서 수영하고 있다,운동장에서 축구 경기를 하고 있다,산 위에서 스키를 타고 있다,거리의 나무에 조명이 켜져 있다,d
train_1131,train/train_1131.jpg,이 사진 속 유명한 건축물은 무엇인가요?,개선문,루브르 박물관,노트르담 대성당,에펠탑,a
train_1132,train/train_1132.jpg,이 사진은 어느 시간대에 찍힌 도시의 모습인가요?,점심,저녁,밤,아침,c
train_1133,train/train_1133.jpg,이 사진이 찍힌 장소는 어디인가요?,함부르크역,베를린역,루트비히스하펜역,뮌헨역,c
train_1134,train/train_1134.jpg,이 이미지에서 보이는 길의 표면 재질은 무엇인가요?,포장된 벽돌,아스팔트,자갈,콘크리트,a
train_1135,train/train_1135.jpg,이 사진 속 시장에서 주로 판매되는 상품은 무엇인가요?,기념품,의류,신선한 과일,전자제품,a
train_1136,train/train_1136.jpg,이 사진은 어느 계절에 촬영된 크리스마스 마켓일까요?,봄,겨울,여름,가을,b
train_1137,train/train_1137.jpg,이 사진에 보이는 큰 건물은 무엇일까요?,교회,도서관,학교,박물관,a
train_1138,train/train_1138.jpg,이 사진에서 볼 수 있는 계절은 무엇인가요?,여름,가을,봄,겨울,d
train_1139,train/train_1139.jpg,이 사진에서 사람들이 걷고 있는 장소는 어떤 곳일까요?,크리스마스 마켓,해변가,학교 운동장,공원,a
train_1140,train/train_1140.jpg,이 사진에서 볼 수 있는 축제나 행사는 무엇과 관련이 있나요?,크리스마스 축제,할로윈 축제,부활절 축제,추수감사절 축제,a
train_1141,train/train_1141.jpg,이 사진에서 보이는 작은 나무 건물은 무엇일 가능성이 가장 높나요?,식당 또는 카페,병원,주택,학교,a
train_1142,train/train_1142.jpg,이 사진에서 보이는 계절은 무엇인가요?,가을,봄,겨울,여름,c
train_1143,train/train_1143.jpg,이 전시물은 무엇과 관련된 모자를 보여주고 있나요?,군인 모자,소방관 모자,철도 직원 모자,경찰 모자,c
train_1144,train/train_1144.jpg,이 사진에서 볼 수 있는 것은 무엇인가요?,해변과 바다가 보이는 풍경,사막과 오아시스,대도시의 고층 빌딩,도시와 강이 보이는 풍경,d
train_1145,train/train_1145.jpg,이 건물에서 볼 수 없는 것은 무엇인가요?,조각상,분수,시계,문,b
train_1146,train/train_1146.jpg,이 사진에 보이는 건물 앞에 놓인 것은 무엇인가요?,연못,크리스마스 트리,자동차,벤치,b
